{
  "$schema": "./skill-sync.schema.json",
  "version": 1,
  "description": "Maps upstream wiki/global skill sources to deployable market_dashboard runtime skill artifacts.",
  "targetsRoot": "packages/core-skills",
  "sourceRoots": {
    "wiki": {
      "description": "Authoring source for trading knowledge.",
      "candidates": [
        "${JIE_WIKI_ROOT}",
        "packages/core-skills/wiki-source"
      ]
    },
    "globalSkills": {
      "description": "Operator skills that stay global/local, used only as upstream references.",
      "candidates": [
        "${JIE_WIKI_SKILLS_ROOT}",
        "packages/core-skills/wiki-source/skills"
      ]
    }
  },
  "skills": [
    {
      "id": "agent-moderator",
      "status": "active",
      "enabled": true,
      "outputs": [
        {
          "kind": "knowledge",
          "target": "agent-moderator/knowledge.md",
          "strategy": "concat-markdown",
          "title": "Agent Moderator Knowledge",
          "sources": [
            { "root": "wiki", "path": "wiki/trading/traders/trader-styles.md" },
            { "root": "wiki", "path": "wiki/trading/traders/trader-style-profiles.md" },
            { "root": "wiki", "path": "wiki/trading/traders/mark-minervini-sepa.md" },
            { "root": "wiki", "path": "wiki/trading/traders/ted-zhang-institutional-momentum.md" },
            { "root": "wiki", "path": "wiki/trading/traders/traderlion-early-entry-techniques.md" },
            { "root": "wiki", "path": "wiki/trading/concepts/entry-methods.md" },
            { "root": "wiki", "path": "wiki/trading/risk/risk-management.md" },
            { "root": "wiki", "path": "wiki/trading/risk/position-sizing.md" },
            { "root": "wiki", "path": "wiki/trading/concepts/relative-strength.md" },
            { "root": "wiki", "path": "wiki/trading/concepts/lockout-rally.md" },
            { "root": "wiki", "path": "wiki/trading/concepts/fundamental-analysis.md" },
            { "root": "wiki", "path": "wiki/trading/traders/qullamaggie-breakouts-episodic-pivots.md" }
          ],
          "applicationNotes": [
            "Use this artifact as shared judgment context when routing or reconciling trader-style agents.",
            "Do not add user-specific broker or account data here."
          ]
        }
      ]
    },
    {
      "id": "trader-primetrading",
      "status": "active",
      "enabled": true,
      "outputs": [
        {
          "kind": "knowledge",
          "target": "trader-primetrading/knowledge.md",
          "strategy": "concat-markdown",
          "title": "PrimeTrading Methodology",
          "sources": [
            { "root": "wiki", "path": "wiki/trading/traders/persona-primetrading.md" },
            { "root": "wiki", "path": "wiki/trading/traders/alex-swing-trading-system.md" },
            { "root": "wiki", "path": "wiki/trading/traders/alex-scans-traderslab.md" },
            { "root": "wiki", "path": "wiki/trading/traders/alex-trading-psychology.md" },
            { "root": "wiki", "path": "wiki/trading/concepts/21dma-structure.md" }
          ],
          "applicationNotes": [
            "Use this artifact when scoring whether a trade follows PrimeTrading/Alex 21dma pullback rules.",
            "Keep the system strict about no breakout chasing, structure-based stops, and market phase alignment."
          ]
        }
      ]
    },
    {
      "id": "trader-scorer-market",
      "status": "active",
      "enabled": true,
      "outputs": [
        {
          "kind": "knowledge",
          "target": "trader-scorer-market/knowledge.md",
          "strategy": "concat-markdown",
          "title": "Market Scorer Knowledge",
          "sources": [
            { "root": "wiki", "path": "wiki/trading/traders/trader-styles.md" },
            { "root": "wiki", "path": "wiki/trading/traders/trader-style-profiles.md" },
            { "root": "wiki", "path": "wiki/trading/concepts/market-timing.md" },
            { "root": "wiki", "path": "wiki/trading/concepts/market-phases.md" },
            { "root": "wiki", "path": "wiki/trading/concepts/lockout-rally.md" },
            { "root": "wiki", "path": "wiki/trading/concepts/relative-strength.md" },
            { "root": "wiki", "path": "wiki/trading/concepts/stock-scanning.md" },
            { "root": "wiki", "path": "wiki/trading/traders/steve-jacobs-market-dashboard.md" },
            { "root": "wiki", "path": "wiki/trading/traders/qullamaggie-breakouts-episodic-pivots.md" }
          ],
          "applicationNotes": [
            "Use this artifact for daily market verdicts, breadth/phase interpretation, and trader-style consensus.",
            "Keep outputs focused on market state, not individual account advice."
          ]
        }
      ]
    },
    {
      "id": "trader-scorer-stock",
      "status": "active",
      "enabled": true,
      "outputs": [
        {
          "kind": "knowledge",
          "target": "trader-scorer-stock/knowledge.md",
          "strategy": "concat-markdown",
          "title": "Stock Scorer Knowledge",
          "sources": [
            { "root": "wiki", "path": "wiki/trading/traders/trader-styles.md" },
            { "root": "wiki", "path": "wiki/trading/traders/trader-style-profiles.md" },
            { "root": "wiki", "path": "wiki/trading/traders/mark-minervini-sepa.md" },
            { "root": "wiki", "path": "wiki/trading/traders/ted-zhang-institutional-momentum.md" },
            { "root": "wiki", "path": "wiki/trading/concepts/fundamental-analysis.md" },
            { "root": "wiki", "path": "wiki/trading/concepts/ticker-catalyst-analysis.md" },
            { "root": "wiki", "path": "wiki/trading/concepts/relative-strength.md" },
            { "root": "wiki", "path": "wiki/trading/concepts/lockout-rally.md" },
            { "root": "wiki", "path": "wiki/trading/traders/qullamaggie-breakouts-episodic-pivots.md" },
            { "root": "wiki", "path": "wiki/trading/traders/lengyan-cold-eye.md" },
            { "root": "wiki", "path": "wiki/trading/traders/lengyan-stock-analyses.md" },
            { "root": "wiki", "path": "wiki/trading/traders/duan-yongping.md" },
            { "root": "wiki", "path": "wiki/trading/concepts/duan-scoring-model.md" }
          ],
          "applicationNotes": [
            "Use this artifact for ticker-level analysis where fundamentals, catalysts, and relative strength matter.",
            "Do not mix in journal-specific entry/exit judgment unless the caller asks for trade review."
          ]
        }
      ]
    },
    {
      "id": "trader-scorer-trade",
      "status": "active",
      "enabled": true,
      "outputs": [
        {
          "kind": "knowledge",
          "target": "trader-scorer-trade/knowledge.md",
          "strategy": "concat-markdown",
          "title": "Trade Scorer Knowledge",
          "sources": [
            { "root": "wiki", "path": "wiki/trading/traders/trader-styles.md" },
            { "root": "wiki", "path": "wiki/trading/traders/trader-style-profiles.md" },
            { "root": "wiki", "path": "wiki/trading/traders/mark-minervini-sepa.md" },
            { "root": "wiki", "path": "wiki/trading/traders/ted-zhang-institutional-momentum.md" },
            { "root": "wiki", "path": "wiki/trading/concepts/entry-methods.md" },
            { "root": "wiki", "path": "wiki/trading/concepts/lockout-rally.md" },
            { "root": "wiki", "path": "wiki/trading/traders/traderlion-early-entry-techniques.md" },
            { "root": "wiki", "path": "wiki/trading/risk/risk-management.md" },
            { "root": "wiki", "path": "wiki/trading/risk/position-sizing.md" },
            { "root": "wiki", "path": "wiki/trading/traders/qullamaggie-breakouts-episodic-pivots.md" },
            { "root": "wiki", "path": "wiki/trading/journal/trade-journal-workflow.md" }
          ],
          "applicationNotes": [
            "Use this artifact when judging an executed or planned trade against style, entry, risk, and journal rules.",
            "The output should cite the specific rule family that improved or hurt the trade score."
          ]
        }
      ]
    },
    {
      "id": "morning-brief",
      "status": "active",
      "enabled": false,
      "reason": "Morning brief has no upstream wiki source today; its runtime format knowledge remains hand-authored from morning_brief.py."
    },
    {
      "id": "chart-annotation",
      "status": "planned",
      "enabled": false,
      "reason": "Manual TradingView screenshot annotation starts as a global Claude/Codex skill before becoming a runtime market_dashboard skill.",
      "outputs": [
        {
          "kind": "knowledge",
          "target": "chart-annotation/knowledge.md",
          "required": false,
          "strategy": "concat-markdown",
          "title": "Pro Trader Chart Annotation Knowledge",
          "sources": [
            { "root": "globalSkills", "path": "pro-trader-chart-annotation/SKILL.md" },
            { "root": "wiki", "path": "wiki/trading/traders/qullamaggie-breakouts-episodic-pivots.md" },
            { "root": "wiki", "path": "wiki/trading/journal/trade-journal-workflow.md" }
          ],
          "applicationNotes": [
            "Use this when the journal supports manual TradingView screenshot upload/paste.",
            "Runtime output should include both an annotated-image plan/asset and a Markdown critique."
          ]
        }
      ]
    },
    {
      "id": "broker-moomoo",
      "status": "planned",
      "enabled": false,
      "reason": "MooMoo should be a separate broker/quote service before becoming a runtime skill artifact.",
      "outputs": [
        {
          "kind": "knowledge",
          "target": "broker-moomoo/knowledge.md",
          "required": false,
          "strategy": "concat-markdown",
          "title": "MooMoo Broker Connector Knowledge",
          "sources": [
            { "root": "globalSkills", "path": "moomooapi/SKILL.md" },